root@lamp-s-1vcpu-1gb-tor1-01:~# tcpdump -n -i eth0
tcpdump: verbose output suppressed, use -v or -vv for full protocol decode
listening on eth0, link-type EN10MB (Ethernet), capture size 262144 bytes
16:37:45.956454 IP 138.197.153.21.22 > 198.96.85.104.50991: Flags [P.], seq 1546405092:1546405200, ack 4120046773, win 295, length 108
16:37:45.956551 IP 138.197.153.21.22 > 198.96.85.104.50991: Flags [P.], seq 108:144, ack 1, win 295, length 36
16:37:45.956645 IP 138.197.153.21.22 > 198.96.85.104.50991: Flags [P.], seq 144:252, ack 1, win 295, length 108
16:37:45.956716 IP 138.197.153.21.22 > 198.96.85.104.50991: Flags [P.], seq 252:288, ack 1, win 295, length 36
16:37:45.956932 IP 138.197.153.21.22 > 198.96.85.104.50991: Flags [P.], seq 288:460, ack 1, win 295, length 172
16:37:45.957010 IP 138.197.153.21.22 > 198.96.85.104.50991: Flags [P.], seq 460:496, ack 1, win 295, length 36
16:37:45.957109 IP 138.197.153.21.22 > 198.96.85.104.50991: Flags [P.], seq 496:644, ack 1, win 295, length 148
16:37:45.957259 IP 138.197.153.21.22 > 198.96.85.104.50991: Flags [P.], seq 644:680, ack 1, win 295, length 36
16:37:45.957450 IP 138.197.153.21.22 > 198.96.85.104.50991: Flags [P.], seq 680:828, ack 1, win 295, length 148
16:37:45.957635 IP 138.197.153.21.22 > 198.96.85.104.50991: Flags [P.], seq 864:1012, ack 1, win 295, length 148
16:37:45.957795 IP 198.96.85.104.50991 > 138.197.153.21.22: Flags [.], ack 496, win 8190, length 0
16:37:45.958003 IP 138.197.153.21.22 > 198.96.85.104.50991: Flags [P.], seq 1232:1380, ack 1, win 295, length 148
16:37:45.958190 IP 198.96.85.104.50991 > 138.197.153.21.22: Flags [.], ack 864, win 8188, length 0
16:37:45.958394 IP 138.197.153.21.22 > 198.96.85.104.50991: Flags [P.], seq 1600:1748, ack 1, win 295, length 148
16:37:45.958601 IP 138.197.153.21.22 > 198.96.85.104.50991: Flags [P.], seq 1784:1932, ack 1, win 295, length 148
16:37:45.958744 IP 198.96.85.104.50991 > 138.197.153.21.22: Flags [.], ack 1416, win 8192, length 0
16:37:45.959011 IP 138.197.153.21.22 > 198.96.85.104.50991: Flags [P.], seq 2152:2284, ack 1, win 295, length 132
16:37:45.959310 IP 198.96.85.104.50991 > 138.197.153.21.22: Flags [.], ack 1932, win 8190, length 0
16:37:45.959599 IP 198.96.85.104.50991 > 138.197.153.21.22: Flags [.], ack 2116, win 8190, length 0
16:37:45.959906 IP 138.197.153.21.22 > 198.96.85.104.50991: Flags [P.], seq 2672:2820, ack 1, win 295, length 148
16:37:45.960098 IP 138.197.153.21.22 > 198.96.85.104.50991: Flags [P.], seq 2856:3004, ack 1, win 295, length 148
16:37:45.960337 IP 138.197.153.21.22 > 198.96.85.104.50991: Flags [P.], seq 3040:3180, ack 1, win 295, length 140
16:37:45.960525 IP 198.96.85.104.50991 > 138.197.153.21.22: Flags [.], ack 2820, win 8193, length 0
16:37:45.960738 IP 138.197.153.21.22 > 198.96.85.104.50991: Flags [P.], seq 3400:3540, ack 1, win 295, length 140
16:37:45.960942 IP 138.197.153.21.22 > 198.96.85.104.50991: Flags [P.], seq 3576:3716, ack 1, win 295, length 140
