root@lamp-s-1vcpu-1gb-tor1-01:~# tcpdump -c 5 -i eth0
tcpdump: verbose output suppressed, use -v or -vv for full protocol decode
listening on eth0, link-type EN10MB (Ethernet), capture size 262144 bytes
16:27:36.622338 IP lamp-s-1vcpu-1gb-tor1-01.ssh > 198.96.85.104.50991: Flags [P.], seq 1539195912:1539196020, ack 4120028109, win 295, length 108
16:27:36.622566 IP lamp-s-1vcpu-1gb-tor1-01.ssh > 198.96.85.104.50991: Flags [P.], seq 108:144, ack 1, win 295, length 36
16:27:36.622763 IP lamp-s-1vcpu-1gb-tor1-01.ssh > 198.96.85.104.50991: Flags [P.], seq 144:252, ack 1, win 295, length 108
16:27:36.622913 IP lamp-s-1vcpu-1gb-tor1-01.ssh > 198.96.85.104.50991: Flags [P.], seq 252:288, ack 1, win 295, length 36
16:27:36.623211 IP 198.96.85.104.50991 > lamp-s-1vcpu-1gb-tor1-01.ssh: Flags [.], ack 108, win 8189, length 0
5 packets captured
17 packets received by filter
5 packets dropped by kernel
