root@lamp-s-1vcpu-1gb-tor1-01:~# tcpdump -r 0001.pcap
reading from file 0001.pcap, link-type EN10MB (Ethernet)
16:34:26.802121 IP lamp-s-1vcpu-1gb-tor1-01.ssh > 198.96.85.104.50991: Flags [P.], seq 1544390548:1544390592, ack 4120040881, win 295, length 44
16:34:26.802234 IP lamp-s-1vcpu-1gb-tor1-01.ssh > 198.96.85.104.50991: Flags [P.], seq 44:152, ack 1, win 295, length 108
16:34:26.802312 IP lamp-s-1vcpu-1gb-tor1-01.ssh > 198.96.85.104.50991: Flags [P.], seq 152:188, ack 1, win 295, length 36
16:34:26.802911 IP 198.96.85.104.50991 > lamp-s-1vcpu-1gb-tor1-01.ssh: Flags [.], ack 152, win 8193, length 0
16:34:26.802938 IP 198.96.85.104.50991 > lamp-s-1vcpu-1gb-tor1-01.ssh: Flags [.], ack 188, win 8192, length 0
16:34:28.389346 IP lamp-s-1vcpu-1gb-tor1-01.ssh > 218.92.0.200.51032: Flags [S.], seq 4151402426, ack 2343760154, win 28960, options [mss 1460,sackOK,TS val 152325523 ecr 313553545,nop,wscale 7], length 0
