root@lamp-s-1vcpu-1gb-tor1-01:~# tcpdump -i eth0
tcpdump: verbose output suppressed, use -v or -vv for full protocol decode
listening on eth0, link-type EN10MB (Ethernet), capture size 262144 bytes
16:24:27.898610 IP lamp-s-1vcpu-1gb-tor1-01.ssh > 198.96.85.104.50991: Flags [P.], seq 1539097400:1539097508, ack 4120025497, win 295, length 108
16:24:27.898744 IP lamp-s-1vcpu-1gb-tor1-01.ssh > 198.96.85.104.50991: Flags [P.], seq 108:144, ack 1, win 295, length 36
16:24:27.898890 IP lamp-s-1vcpu-1gb-tor1-01.ssh > 198.96.85.104.50991: Flags [P.], seq 144:252, ack 1, win 295, length 108
16:24:27.898972 IP lamp-s-1vcpu-1gb-tor1-01.ssh > 198.96.85.104.50991: Flags [P.], seq 252:288, ack 1, win 295, length 36
16:24:27.899503 IP 198.96.85.104.50991 > lamp-s-1vcpu-1gb-tor1-01.ssh: Flags [.], ack 144, win 8191, length 0
16:24:27.899622 IP 198.96.85.104.50991 > lamp-s-1vcpu-1gb-tor1-01.ssh: Flags [.], ack 288, win 8190, length 0
16:24:27.901145 IP lamp-s-1vcpu-1gb-tor1-01.ssh > 198.96.85.104.50991: Flags [P.], seq 288:468, ack 1, win 295, length 180
16:24:27.901551 IP lamp-s-1vcpu-1gb-tor1-01.ssh > 198.96.85.104.50991: Flags [P.], seq 504:660, ack 1, win 295, length 156
16:24:27.901869 IP lamp-s-1vcpu-1gb-tor1-01.ssh > 198.96.85.104.50991: Flags [P.], seq 696:852, ack 1, win 295, length 156
16:24:27.902088 IP 198.96.85.104.50991 > lamp-s-1vcpu-1gb-tor1-01.ssh: Flags [.], ack 504, win 8189, length 0
16:24:27.902528 IP 198.96.85.104.50991 > lamp-s-1vcpu-1gb-tor1-01.ssh: Flags [.], ack 852, win 8188, length 0
16:24:27.902755 IP lamp-s-1vcpu-1gb-tor1-01.ssh > 198.96.85.104.50991: Flags [P.], seq 1264:1412, ack 1, win 295, length 148
16:24:27.902923 IP lamp-s-1vcpu-1gb-tor1-01.ssh > 198.96.85.104.50991: Flags [P.], seq 1448:1604, ack 1, win 295, length 156
16:24:27.903052 IP 198.96.85.104.50991 > lamp-s-1vcpu-1gb-tor1-01.ssh: Flags [.], ack 1044, win 8193, length 0
16:24:27.903348 IP lamp-s-1vcpu-1gb-tor1-01.ssh > 198.96.85.104.50991: Flags [P.], seq 1832:1988, ack 1, win 295, length 156
16:24:27.903605 IP 198.96.85.104.50991 > lamp-s-1vcpu-1gb-tor1-01.ssh: Flags [.], ack 1604, win 8191, length 0
16:24:27.903942 IP 198.96.85.104.50991 > lamp-s-1vcpu-1gb-tor1-01.ssh: Flags [.], ack 1988, win 8190, length 0
16:24:27.904201 IP lamp-s-1vcpu-1gb-tor1-01.ssh > 198.96.85.104.50991: Flags [P.], seq 2392:2556, ack 1, win 295, length 164
16:24:27.904345 IP 198.96.85.104.50991 > lamp-s-1vcpu-1gb-tor1-01.ssh: Flags [.], ack 2172, win 8189, length 0
16:24:27.904588 IP lamp-s-1vcpu-1gb-tor1-01.ssh > 198.96.85.104.50991: Flags [P.], seq 2792:2940, ack 1, win 295, length 148
16:24:27.904904 IP lamp-s-1vcpu-1gb-tor1-01.ssh > 198.96.85.104.50991: Flags [P.], seq 2976:3140, ack 1, win 295, length 164
16:24:27.905297 IP 198.96.85.104.50991 > lamp-s-1vcpu-1gb-tor1-01.ssh: Flags [.], ack 2940, win 8192, length 0
16:24:27.905656 IP 198.96.85.104.50991 > lamp-s-1vcpu-1gb-tor1-01.ssh: Flags [.], ack 3140, win 8191, length 0
16:24:27.906032 IP lamp-s-1vcpu-1gb-tor1-01.ssh > 198.96.85.104.50991: Flags [P.], seq 3544:3708, ack 1, win 295, length 164
16:24:27.906242 IP lamp-s-1vcpu-1gb-tor1-01.ssh > 198.96.85.104.50991: Flags [P.], seq 3744:3892, ack 1, win 295, length 148
